date,title,source,link,contents
2021.12.27.,"DGB생명, 장애인 직업재활시설에 운영자금 전달",핀포인트뉴스,http://www.pinpointnews.co.kr/view.php?ud=2021122709443797419f27410725_45,27일 DGB생명보험은 코로나19 확산과 방역 강화로 어려움을 겪는 장애인 직업재활시설에 운영자금을 지원했다고 밝혔다. DGB생명은 24일 경북 봉화군 소재 하눌보호작업장을 방문해 DGB사회공헌재단에서 출연한 기부금...
2021.12.27.,"DGB생명, 장애인 직업재활시설 운영자금 지원",증권경제신문,http://www.koreastocknews.com/news/articleView.html?idxno=69096,(사진=DGB생명 제공)  DGB생명보험(대표 김성한)은 장애인 직업재활시설에 운영자금을 지원했다고 27일 밝혔다. DGB생명은 최근 경북 봉화군 소재 하눌보호작업장을 방문해 DGB사회공헌재단에서 출연한 기부금 500만원을...
2021.12.27.,"DGB생명, 하눌보호작업장 이용장애인 위한 운영자금 기부",조세일보,http://www.joseilbo.com/news/news_read.php?uid=442089&class=18&grp=,DGB생명보험이 코로나19 확산과 방역 강화로 어려움을 겪는 장애인 직업재활시설에 운영자금을 지원했다고 27일 밝혔다. DGB생명은 지난 24일 경북 봉화군 소재 하눌보호작업장을 방문해 DGB사회공헌재단에서 출연한...
2021.12.27.,"DGB생명, 경북 봉화 장애인 직업재활시설에 기부금 전달",한국보험신문,http://www.insnews.co.kr/design_php/news_view.php?num=68105&firstsec=1&secondsec=12,DGB생명보험은 코로나19 확산과 방역 강화로 어려움을 겪는 장애인 직업재활시설에 운영자금을 지원했다고 27일 밝혔다. DGB생명은 24일 경북 봉화군 소재 하눌보호작업장을 방문해 DGB사회공헌재단에서 출연한 기부금...
2021.12.27.,"DGB생명, 장애인 직업재활시설에 운영자금 지원",파이낸셜뉴스,http://www.fnnews.com/news/202112271348110889,DGB생명보험은 코로나19 확산과 방역 강화로 어려움을 겪는 장애인 직업재활시설에 운영자금을 지원했다고 27일 밝혔다. DGB생명은 지난 24일 경북 봉화군 하눌보호작업장을 방문해 DGB사회공헌재단에서 출연한 기부금...
2021.12.27.,"DGB생명, 장애인 직업재활시설에 운영자금 지원",EBN,https://www.ebn.co.kr/news/view/1513766/?sc=Naver,DGB생명보험은 코로나19 확산과 방역 강화로 어려움을 겪는 장애인 직업재활시설에 운영자금을 지원했다고 27일 밝혔다. DGB생명은 지난 24일 경북 봉화군 하눌보호작업장을 방문해 DGB사회공헌재단에서 출연한 기부금...
2021.12.27.,"DGB생명, 장애인 직업재활시설에 운영자금 지원",현대경제신문,http://www.finomy.com/news/articleView.html?idxno=104630,DGB생명보험은 코로나19 확산과 방역 강화로 어려움을 겪는 장애인 직업재활시설에 운영자금을 지원했다고 27일 밝혔다. DGB생명은 지난 24일 경북 봉화군 소재 하눌보호작업장을 방문해 DGB사회공헌재단에서 출연한...
2021.12.27.,"DGB생명, 장애인 직업재활시설에 500만원 기부",에너지경제,https://www.ekn.kr/web/view.php?key=20211227010004469,DGB생명보험은 코로나19 확산과 방역 강화로 어려움을 겪는 장애인 직업재활시설에 운영자금을 지원했다고 27일 밝혔다. DGB생명은 지난 24일 경북 봉화군 소재 하눌보호작업장을 방문해 DGB사회공헌재단에서 출연한...
2021.12.27.,"[기업사회활동] DGB생명, 경북 장애인 직업재활시설에 운영자금 지원",로이슈,http://www.lawissue.co.kr/view.php?ud=2021122718501082899817d053b9_12,DGB생명보험은 코로나19 확산과 방역 강화로 어려움을 겪는 장애인 직업재활시설에 운영자금을 지원했다고 27일 밝혔다. DGB생명은 24일 경북 봉화군 소재 하눌보호작업장을 방문해 DGB사회공헌재단에서 출연한 기부금...
2021.12.28.,"""힘들지 않게""...DGB생명, 장애인 직업재활시설에 운영자금 기부",청년일보,http://www.youthdaily.co.kr/news/article.html?no=89192,"경북 봉화군 소재 ‘하눌보호작업장’에 시설운영자금 500만원 기부 DGB생명 ""코로나19 장기화 속 사회복지시설과 나눔지원 지속할 것"" DGB생명보험(이하 DGB생명)은 27일 코로나19 확산으로 인한 방역 강화로 어려움을..."
2021.12.28.,변액보험 갈아탄 DGB생명의 속내는?,메트로신문,http://www.metroseoul.co.kr/article/20211228500019,"IFRS17 도입 이후 회계상 긍정적 효과 기대 DGB생명, 변액보험 성장세도 가파른 모습 ""김성한 대표 취임 이후 포트폴리오 재편"" DGB생명보험 CI. /DGB생명 DGB생명보험이 상품 포트폴리오 새판 짜기에 나서고 있다...."
2021.12.30.,‘통일과나눔아카데미’ 제16기 졸업식,조선일보,https://www.chosun.com/national/people/2021/12/30/3MS6IIG3AZFE7DB325H2LKNENY/?utm_source=naver&utm_medium=referral&utm_campaign=naver-news,"앞줄 왼쪽부터 안청락 한중교류문화원 이사장, 김성한 DGB생명보험 대표이사, 라종억 통일문화연구원 이사장, 조명숙 여명학교 교장, 홍준호 조선일보 발행인, 이상학 KT&amp;G 부사장. 조형준 통일문화포럼 회장. 뒷줄..."
2021.12.30.,"[카드] DGB생명보험, 김성한 대표이사 법무부장관상 수상",프라임경제,http://www.newsprime.co.kr/news/article.html?no=558554,DGB생명보험은 선플재단에서 주최하는 '2021 선플활동결과 보고대회 및 선플상 시상식'에서 김성한 대표이사가 법무부장관상을 수상했다고 30일 밝혔다.
2021.12.31.,대구에서 서울로… 여러분도 DGB금융센터 전광판 속 ‘단디’ 보셨나요?,한국금융신문,http://www.fntimes.com/html/view.php?ud=2021123100224832489249a1ae63_18,송출 영상은 공익광고 의무 노출 시간을 제외하고는 외부 광고 없이 오로지 ▲DGB금융지주 ▲DGB대구은행(은행장 임성훈) ▲DGB캐피탈(대표 서정동) ▲DGB생명보험(대표 김성한) ▲하이자산운용(대표 박정홍)...
2022.01.06.,현대캐피탈ㆍDGB생명ㆍKDB생명 소비자보호 평가‘낙제점’,e대한경제,https://www.dnews.co.kr/uhtml/view.jsp?idxno=202201061305459620421,"현대캐피탈과 DGB생명보험, KDB생명보험이 2021년도 금융소비자보호 실태평가에서 ‘미흡’ 등급을 받았다. 국민은행, 현대카드, 삼성증권는 ‘양호’ 등급을 받았다. ‘우수’ 등급을 받은 금융사는 단 한 곳도..."
2022.01.06.,"금융소비자보호 실태평가 해보니…`우수` 0, DGB생명·KDB생명·현대캐피탈 `...",디지털타임스,http://www.dt.co.kr/contents.html?article_no=2022010702100863054002&ref=naver,"현대캐피탈과 DGB생명보험, KDB생명보험 등은 소비자 피해 예방에 결함이 존재한다는 평가를 받았다. 6일 금융감독원은 26개 금융사를 대상으로 실시한 2021년도 금융소비자보호 실태평가 결과 '우수' 금융회사는 한 곳도..."
2022.01.07.,"DGB생명 변액보험, 규모 작지만 펀드수익률 '굿'",스트레이트뉴스,https://www.straightnews.co.kr/news/articleView.html?idxno=201930,현재 DGB생명의 변액보험 펀드 라인업은 13종이며 2021년 판매한 상품 중 변액보험 비중은 약 93%에 달한다. DGB생명이 지난 2020년 11월 출시한 핵심 주력상품 '마이솔루션AI변액연금'에 속한 '글로벌 AI 플랫폼 액티브형...
2022.01.07.,"DGB생명, 지난해 변액보험펀드 수익률 1위",보험매일,http://www.fins.co.kr/news/articleView.html?idxno=92449,2021년 전체 변액보험펀드의 수익률을 산출해 비교한 결과 DGB생명 변액보험펀드는 단순평균 수익률(9.15%) 및 가중평균(기말) 수익률(8.73%)에서 모두 1위를 기록했다. 수익률은 생명보험협회 자료와 연합인포맥스...
2022.01.07.,"DGB생명 작년 보험사 변액보험펀드 수익률 1위, 평균 9.15%",비즈니스포스트,https://www.businesspost.co.kr/BP?command=article_view&num=267623,"DGB생명은 2021년 전체 변액보험펀드의 수익률을 비교한 결과 DGB생명의 변액보험펀드가 단순평균 수익률 9.15%, 가중평균(기말) 수익률 8.73%로 모두 1위를 차지했다고 7일 밝혔다. 변액보험펀드 수익률은 생명보험협회..."
2022.01.07.,"DGB생명, 작년 변액보험펀드 수익률 1위 차지",시장경제신문,http://www.meconomynews.com/news/articleView.html?idxno=62142,변액보험펀드 단순평균·가중평균 수익률 상위 [시장경제=문혜원 기자] DGB생명보험사 사진 = DGB생명보험 DGB생명이 지난해 변액보험펀드 수익률 1위에 올랐다. 변화하는 회계제도와 보험가입자들의 투자 니즈에...
2022.01.07.,"DGB생명, 변액보험펀드 9% 수익률 21개사중 1위",매일경제,http://news.mk.co.kr/newsRead.php?no=21785&year=2022,현재 DGB생명 변액보험펀드 라인업은 13종이며 2021년 판매한 상품 중 변액보험 비중은 약 93%에 달한다. 이번 수익률 비교는 생명보험협회 자료와 연합인포맥스 변액보험펀드 수익률 데이터베이스를 기반으로...
2022.01.10.,"DGB생명보험, 여성가족부 ‘가족친화인증’ 기업으로 선정",데일리한국,https://daily.hankooki.com/lpage/finance/202201/dh20220110090620148330.htm?s_ref=nv,‘사람중심 기업가정신’ 기반으로 가족친화 직장문화 안정적 정착 DGB생명보험은 여성가족부가 선정하는 ‘2021 가족친화기업’으로 인증을 받았다고 10일 밝혔다. ‘가족친화인증’이란 근로자의 일·가정 양립을...
2022.01.10.,"DGB생명, 여가부서 '2021 가족친화기업' 인증 획득…""일-가정 양립 지원""",핀포인트뉴스,http://www.pinpointnews.co.kr/view.php?ud=2022011009134870259f27410725_45,DGB생명보험이 근로자의 일과 가정 양립을 지원해온 결과를 여성가족부로부터 인정받았다. 10일 DGB생명은 여성가족부가 선정하는 ‘2021 가족친화기업’으로 인증을 받았다고 밝혔다. ‘가족친화인증’이란 근로자의...
2022.01.10.,"[카드] DGB생명보험, 여성가족부 '가족친화인증' 기업 선정",프라임경제,http://www.newsprime.co.kr/news/article.html?no=559148,DGB생명보험은 여성가족부가 선정하는 '2021 가족친화기업'으로 인증을 받았다고 10일 밝혔다.
2022.01.12.,"DGB생명, 변액보험 1등 잡기 '안간힘'",보험매일,http://www.fins.co.kr/news/articleView.html?idxno=92493,현재 DGB생명은 보험사 재무건전성을 나타내는 RBC비율이 크게 악화한 상태다. 국내외 금리가 오름세일 것으로 전망되는 가운데 향후 RBC비율은 더욱 하락할 가능성이 크다. 금융감독원에 따르면 지난해 3분기...
2022.01.12.,보장과 투자를 동시에 '변액보험펀드' 관심 'UP',신아일보,http://www.shinailbo.co.kr/news/articleView.html?idxno=1504713,"아울러 DGB생명 변액보험펀드 평균 수익률은 단순평균 9.15%, 가중평균(기말) 8.73%로 집계됐다. 단순 평균 수익률은 각 보험사가 보유한 펀드 수익률을 모두 더해 펀드 개수로 나눈 것이다. 순자산 가중평균(기말)..."
2022.01.21.,‘4세대 실손보험’ 안 파는 라이나·AIA생명…“이익 위해 소비자 외면”,뉴스웨이,http://www.newsway.co.kr/news/view?tp=1&ud=2022012115340455994,▲AXA손해보험 ▲ACE손해보험 ▲AIG손해보험 ▲푸본현대생명 ▲DGB생명보험 ▲KB생명보험 ▲미래에셋생명보험 ▲DB생명보험 등이 그 주인공이다. 그 중 AXA손보는 지난 2012년 판매를 중단해 사실상 의무가 없지만...
2022.01.24.,[보험 브리핑] 교보라이프플래닛·미래에셋·DGB생명·흥국화재,메트로신문,http://www.metroseoul.co.kr/article/20220124500107,"/DGB생명 DGB생명보험이 청년 기업인 육성을 위해 나섰다. DGB생명은 사단법인 도전과나눔을 통해 스타트업 CEO들을 후원하고, 이들과 함께 도전과나눔이 진행하는 '기업가정신 포럼'에 참여했다고 24일 밝혔다. 최근 서울..."
2022.02.14.,"DGB생명, 실손보험 간편청구 시행",아이뉴스24,http://www.inews24.com/view/1451161,DGB생명 실손보험 가입자들은 지앤넷 플랫폼과 연동된 병원에서 진료 등을 받으면 병원 내에 있는 키오스크(무인단말기)나 '실손보험 빠른청구' 스마트폰 애플리케이션으로 보험금을 청구할 수 있다. 현재 서비스를...
2022.02.14.,"DGB생명, '실손보험 간편청구' 서비스 시행",파이낸셜뉴스,http://www.fnnews.com/news/202202140918209070,DGB생명은 보험금 청구를 간편화하고 보험회사의 효율성도 대폭 개선하겠다는 금융당국의 정책에 적극적으로 협조하는 차원에서 이번 서비스 도입을 추진했다. 실제 지난 2018년 금융위원회는 이와 같은 취지로...
2022.02.14.,"DGB생명, 실손보험 간편청구 서비스 시행",보험매일,http://www.fins.co.kr/news/articleView.html?idxno=92750,"DGB생명은 보험 소비자의 당연한 권리인 보험금 청구를 간편화하고, 보험회사의 효율성을 대폭 개선하겠다는 금융당국의 정책에 적극적으로 협조하는 차원에서 이번 서비스 도입을 추진했다. 실제 지난 2018년..."
2022.02.14.,"DGB생명, '실손보험 간편청구' 서비스 시행",헤럴드경제,http://news.heraldcorp.com/view.php?ud=20220214000229,DGB생명은 보험금 청구를 간편화하고 보험회사의 효율성도 대폭 개선하겠다는 금융당국의 정책에 적극적으로 협조하는 차원에서 이번 서비스 도입을 추진했다. 금융위는 2018년 이같은 취지로 보험사들의 실손의료보험...
2022.02.14.,"키오스크·앱으로 실손 청구…DGB생명, ‘간편청구’ 서비스 시행",디지털타임스,http://www.dt.co.kr/contents.html?article_no=2022021402109963075001&ref=naver,DGB생명보험은 의료정보전송 플랫폼 전문기업 지앤넷과 제휴를 맺고 '실손보험 간편청구' 서비스를 오픈했다고 14일 밝혔다. 실손보험 간편청구 서비스는 고객이 지앤넷의 플랫폼과 연동된 병원을 이용하는 경우 별도...
2022.02.15.,모회사 증자 덕에 건전성 지킨 DGB생명…후순위채 만기는 '부담',연합인포맥스,http://news.einfomax.co.kr/news/articleView.html?idxno=4198674,"DGB생명보험이 올해 만기를 맞는 다수의 후순위채에 대응해 향후 지급여력(RBC)비율 관리에 고삐를 죌 것으로 전망된다. 15일 보험업계에 따르면 DGB생명은 올해 4월(150억원)과 7월(400억원), 9월(200억원)에 걸쳐..."
2022.02.22.,보험업계 '우수 인재 잡아라'...인력 유치 경쟁,파이낸셜뉴스,http://www.fnnews.com/news/202202221110029465,"22일 보험업계에 따르면 악사손해보험, DB손해보험, DGB생명 등 보험사들이 내부 문화 혁신을 거듭하며 경쟁력을 내세우고 있다. ■악사손보, 직원 역량 계발 기회 제공 악사손해보험은 가족 친화적인 기업 문화와..."
2022.02.22.,"`워라밸·직급 간소화`…보험업계, 인력 확보戰",디지털타임스,http://www.dt.co.kr/contents.html?article_no=2022022202109963075007&ref=naver,"22일 보험업계에 따르면 악사(AXA)손해보험, DB손해보험, DGB생명 등 보험사들은 핵심 인재들의 다양한 니즈를 충족해 주는 근무 환경을 마련하는 등 기업 문화 혁신에 힘쓰고 있다. 악사손해보험은 가족 친화적인 기업..."
2022.03.10.,"""신용카드로 저축한다고?!""...DGB생명, '실적플러스저축보험' 3000건 한정 판...",데일리한국,http://daily.hankooki.com/news/articleView.html?idxno=798221,아울러 DGB생명은 보험업계의 디지털 전환에 발맞춰 홈페이지에서 간편하게 가입이 가능한 디지털 보험상품을 개발하고 국내외 핀테크 기업들과의 제휴를 통해 고객 편의성을 증진할 수 있는 다양한 상품과 기능을...
2022.03.10.,"DGB생명, 3000건 한정 ‘실적플러스저축보험’ 판매",조세일보,http://www.joseilbo.com/news/news_read.php?uid=448503&class=18&grp=,DGB생명은 보험업계의 디지털 전환에 발맞춰 홈페이지에서 간편하게 가입이 가능한 디지털 보험상품을 개발하고 국내외 핀테크 기업들과의 제휴를 통해 고객 편의성을 증진할 수 있는 다양한 상품과 기능을 지속적으로...
2022.03.10.,"DGB생명, '실적플러스저축보험' 3000건 한정 판매",파이낸셜뉴스,http://www.fnnews.com/news/202203100915083637,또한 DGB생명은 보험업계의 디지털 전환에 발맞춰 홈페이지에서 간편하게 가입이 가능한 디지털 보험상품을 개발하고 국내외 핀테크 기업들과의 제휴를 통해 고객 편의성을 증진할 수 있는 다양한 상품과 기능을...
2022.03.10.,"DGB생명, '실적플러스저축보험' 3000건 한정 판매",보험매일,http://www.fins.co.kr/news/articleView.html?idxno=92971,DGB생명은 보험업계의 디지털 전환에 발맞춰 국내외 핀테크 기업들과의 제휴를 통해 고객 편의성을 증진할 수 있는 다양한 상품과 기능을 지속적으로 확대할 방침이다. 박재석 DGB생명 디지털운영실장은...
2022.03.10.,"DGB생명, ‘실적플러스저축보험’ 3000건 한정 판매",세계비즈,http://www.segyebiz.com/newsView/20220310506377?OutUrl=naver,아울러 DGB생명은 보험업계의 디지털 전환에 발맞춰 홈페이지에서 간편하게 가입이 가능한 디지털 보험상품을 개발하고 국내외 핀테크 기업들과의 제휴를 통해 고객 편의성을 증진할 수 있는 다양한 상품과 기능을...
2022.03.10.,만기시 2.4% 확정금리로 원금보장… 눈길 끄는 디지털 저축보험,머니S,http://moneys.mt.co.kr/news/mwView.php?no=2022031010318085976,DGB생명은 보험업계의 디지털 전환에 발맞춰 홈페이지에서 간편하게 가입이 가능한 디지털 보험상품을 개발하고 국내외 핀테크 기업들과 제휴를 통해 고객 편의성을 증진할 수 있는 다양한 상품과 기능을 지속적으로...
2022.03.10.,[보험 브리핑] DB손보·삼성화재·코리안리·라이나·DGB생명,메트로신문,http://www.metroseoul.co.kr/article/20220310500228,DGB생명은 보험업계의 디지털 전환에 발맞춰 홈페이지에서 간편하게 가입이 가능한 디지털 보험상품도 개발하고 있다. 향후에도 국내외 핀테크 기업들과의 제휴를 통해 고객 편의성을 증진할 수 있는 다양한 상품과...
2022.03.10.,"DGB생명, '실적플러스저축보험' 3000건 한정 판매…원금보장·2.4% 확정금리",위클리오늘,http://www.weeklytoday.com/news/articleView.html?idxno=465000,DGB생명은 보험업계의 디지털 전환에 발맞춰 홈페이지에서 간편하게 가입이 가능한 디지털 보험상품을 개발하고 국내외 핀테크 기업들과의 제휴를 통해 고객 편의성을 증진할 수 있는 다양한 상품과 기능을...
2022.03.10.,"DGB생명, '실적플러스저축보험' 3천건 한정 판매",현대경제신문,http://www.finomy.com/news/articleView.html?idxno=108080,아울러 DGB생명은 보험업계의 디지털 전환에 발맞춰 홈페이지에서 간편하게 가입이 가능한 디지털 보험상품을 개발하고 국내외 핀테크 기업들과의 제휴를 통해 고객 편의성을 증진할 수 있는 다양한 상품과 기능을...
2022.03.10.,"DGB생명, ‘실적플러스저축보험’ 3000건 한정 판매",한국보험신문,http://www.insnews.co.kr/design_php/news_view.php?num=68887&firstsec=1&secondsec=12,아울러 DGB생명은 보험업계의 디지털 전환에 발맞춰 홈페이지에서 간편하게 가입이 가능한 디지털 보험상품을 개발하고 국내외 핀테크 기업들과의 제휴를 통해 고객 편의성을 증진할 수 있는 다양한 상품과 기능을...
2022.03.11.,"보험업계, '실손보험 간편청구 서비스' 앞다퉈 선보이는 까닭",인사이트코리아,http://www.insightkorea.co.kr/news/articleView.html?idxno=95337,"미래에셋생명, 롯데손해보험, DGB생명의 보험금 청구 간소화 서비스 관련 이미지.&lt;각 사&gt;  국내 주요 보험사들이 실손의료보험(실손보험) 보험금 청구 간소화 서비스 확대에 적극 나서고 있다. 의료정보전송 플랫폼..."
2022.03.14.,"DGB생명 ""산불 피해 고객 특별 금융지원 제공""",아시아경제,https://view.asiae.co.kr/article/2022031408271711988,"DGB생명보험은 최근 울진, 삼척지역 산불로 피해를 입은 고객들을 돕고 신속한 재해복구를 지원하기 위한 특별 금융지원을 시행한다고 14일 밝혔다. 우선 산불로 피해를 입은 고객의 보험료 납입을 유예할 수 있도록..."
2022.03.14.,"DGB생명, 울진·삼척 산불 피해 위해 특별 금융 지원 제공",조선비즈,https://biz.chosun.com/stock/finance/2022/03/14/CJ3ZQ3QQXRDODHZUG5KFUPDFLQ/?utm_source=naver&utm_medium=original&utm_campaign=biz,"DGB생명보험은 최근 산불로 피해를 입은 울진, 삼척 지역 고객들을 돕기 위한 특별 금융 지원을 시행한다고 14일 발표했다. DGB생명은 산불로 피해를 입은 고객의 보험료 납입을 유예하도록 했다. 유예기간은..."
2022.03.14.,"[동해안 산불] DGB생명, 피해 고객에 특별 금융지원",연합뉴스,http://yna.kr/AKR20220314024800002?did=1195m,"보험료 납입·대출원리금 상환유예, 보험금 신속 지급 DGB생명보험은 최근 울진, 삼척지역 산불로 피해를 본 고객들에게 특별 금융지원을 한다고 14일 밝혔다. 이를 위해 산불로 피해를 본 고객의 보험료 납입을..."
2022.03.14.,"DGB생명, 울진∙삼척지역 산불 피해 고객에 특별 금융지원",보험매일,http://www.fins.co.kr/news/articleView.html?idxno=93008,"DGB생명보험은 최근 울진, 삼척지역 산불로 피해를 입은 고객들을 위해 특별 금융지원을 시행한다고 14일 밝혔다. 우선 DGB생명은 산불로 피해를 입은 고객의 보험료 납입을 유예할 수 있도록 조치한다. 보험료..."
2022.03.14.,"DGB생명, 울진·삼척지역 산불 피해 특별 금융지원",이뉴스투데이,http://www.enewstoday.co.kr/news/articleView.html?idxno=1554632,DGB생명보험이 울진·삼척지역 산불 피해고객을 위한 특별 금융지원을 시행한다. 특별 금융지원은 정부·지자체의 재난복구자금 지원결정을 받은 경우 '재해피해확인서'를 DGB생명 콜센터를 통해 제출하면 신청할 수...
2022.03.14.,"DGB생명, 산불피해 고객에 보험료 납입·대출금 상환유예",뉴스1,https://www.news1.kr/articles/?4614286,"DGB생명보험이 울진, 삼척 산불로 피해 고객을 대상으로 특별 금융지원을 한다고 14일 밝혔다. DGB생명은 산불로 피해를 본 이용자의 보험료 납입을 유예한다. 보험료는 피해일로부터 올해 8월31일까지 납입 유예할 수..."
2022.03.14.,"DGB생명, 울진∙삼척지역 산불 피해 고객에 특별 금융지원 제공",청년일보,https://www.youthdaily.co.kr/news/article.html?no=95099,산불 피해 고객에 보험료 납입·대출원리금 상환유예 등 지원 8월 31까지 ‘재해피해확인서’ 제출하면 신청 가능 DGB생명보험(대표 김성한)은 최근 울진∙삼척지역 산불로 피해를 입은 고객들을 돕고 신속한...
2022.03.14.,"DGB생명, 울진∙삼척 산불 피해 고객 대상 특별 금융지원",이투데이,https://www.etoday.co.kr/news/view/2113680,"이투데이=김유진 기자 | 보험료 납입 및 대출원리금 상환유예, 보험금 신속지급 제공 DGB생명보험은 최근 울진, 삼척지역 산불로 피해를 본 고객들을 돕고 신속한 재해복구를 지원하기 위한 특별 금융지원을 시행한다고..."
2022.03.14.,"DGB생명, 울진·삼척 지역민 대상 특별 금융지원 시행",EBN,https://www.ebn.co.kr/news/view/1522903/?sc=Naver,DGB생명보험은 울진·삼척 지역 산불로 피해를 입은 고객들을 돕고 신속한 재해복구를 지원하기 위한 특별 금융지원을 시행한다고 14일 밝혔다. DGB생명은 산불로 피해를 입은 고객의 보험료 납입을 유예할 수 있도록...
2022.03.14.,"DGB금융그룹·DGB생명, 산불 피해 고객 위한 특별 금융지원 제공",뉴스케이프,http://www.newscape.co.kr/news/articleView.html?idxno=80679,"DGB생명보험은 최근 울진, 삼척지역 산불로 피해를 입은 고객들을 돕고 신속한 재해복구를 지원하기 위한 특별 금융지원을 시행한다고 14일 밝혔다. 우선, DGB생명은 산불로 피해를 입은 고객의 보험료 납입을 유예할..."
2022.03.14.,"DGB생명, 울진·삼척지역 특별 금융지원 제공",파이낸셜뉴스,http://www.fnnews.com/news/202203141005403986,"DGB생명보험은 최근 울진, 삼척지역 산불로 피해를 입은 고객들을 돕고 신속한 재해복구를 지원하기 위한 특별 금융지원을 시행한다고 14일 밝혔다. 우선 산불로 피해를 입은 고객의 보험료 납입을 유예할 수 있도록..."
